[
  {
    "id": "EX-1",
    "plane": "experience",
    "title": "EX-1 Enterprise Agent Gateway（統一フロントドア）",
    "summary": "すべてのエージェント要求が通る単一の入口で、認証・分類・リスク判定・レート制御・監査エントリを一元適用するパターン。",
    "applies_when": [
      "enterprise_scale",
      "multi_channel",
      "audit_required",
      "customer_facing"
    ],
    "not_applies_when": [
      "poc_phase",
      "single_team"
    ],
    "decision_keys": [
      "DC-1",
      "TO-5",
      "TO-8"
    ],
    "value_drivers": [
      "employee_efficiency",
      "audit_compliance"
    ],
    "kpis": [
      "エージェント利用率",
      "平均応答時間",
      "認証失敗率"
    ],
    "prerequisites": [
      "ID-1",
      "ID-2",
      "ID-6"
    ],
    "related": [],
    "maturity_stage": "foundation",
    "mvp": "単一チャネル（Slack or Web）で認証・レート制限・監査ログを統合したゲートウェイを構築",
    "cost_orientation": "M"
  },
  {
    "id": "EX-2",
    "plane": "experience",
    "title": "EX-2 業務埋め込み＋独立ワークベンチ（チャネル配置）",
    "summary": "EX-1 Gateway をどこに設置するかの構成オプション。日常ツール埋め込みと横断・承認向け独立ワークベンチを組み合わせる配置パターン。",
    "applies_when": [
      "multi_channel",
      "enterprise_scale",
      "long_running",
      "hitl_approval"
    ],
    "not_applies_when": [
      "poc_phase",
      "single_team"
    ],
    "decision_keys": [
      "TO-5",
      "TO-8"
    ],
    "value_drivers": [
      "employee_efficiency",
      "automation"
    ],
    "kpis": [
      "タスク完了率",
      "コンテキスト切り替え回数",
      "利用頻度"
    ],
    "prerequisites": [
      "EX-1",
      "EX-3"
    ],
    "related": [],
    "maturity_stage": "foundation",
    "mvp": "主要業務ツール1つにインライン埋め込み＋Webポータルのみ",
    "cost_orientation": "S"
  },
  {
    "id": "EX-3",
    "plane": "experience",
    "title": "EX-3 チャネル非依存フロントドア",
    "summary": "複数チャネルから同一エージェントを呼び出せるようにチャネルアダプターで差異を吸収し、ID・スコープ・履歴・監査を一貫して管理するパターン。",
    "applies_when": [
      "multi_channel",
      "audit_required",
      "enterprise_scale"
    ],
    "not_applies_when": [
      "single_team",
      "poc_phase"
    ],
    "decision_keys": [
      "TO-8",
      "TO-11"
    ],
    "value_drivers": [
      "customer_value",
      "employee_efficiency"
    ],
    "kpis": [
      "チャネル横断応答一貫性",
      "チャネル追加リードタイム"
    ],
    "prerequisites": [
      "EX-1",
      "ID-2"
    ],
    "related": [],
    "maturity_stage": "foundation",
    "mvp": "Slack＋Webの2チャネルで共通API層を構築",
    "cost_orientation": "S"
  },
  {
    "id": "EX-4",
    "plane": "experience",
    "title": "EX-4 信頼と価値実感のUX（定着を支える体験設計）",
    "summary": "根拠提示・確信度表示・修正容易性・価値の即時フィードバックにより、利用者の信頼を獲得し定着率を高める体験パターン。",
    "applies_when": [
      "enterprise_scale",
      "adoption_challenge",
      "prod_deployment"
    ],
    "not_applies_when": [
      "poc_phase",
      "autonomous_exec"
    ],
    "decision_keys": [
      "TO-5",
      "DC-1"
    ],
    "value_drivers": [
      "employee_efficiency",
      "revenue_growth"
    ],
    "kpis": [
      "ユーザー信頼度スコア",
      "定着率(WAU/MAU)",
      "タスク委譲率"
    ],
    "prerequisites": [
      "EX-1",
      "KM-1",
      "RT-3"
    ],
    "related": [],
    "maturity_stage": "value_loop",
    "mvp": "根拠表示＋確信度インジケータ＋簡易フィードバックUI",
    "cost_orientation": "S"
  },
  {
    "id": "GV-1",
    "plane": "governance",
    "title": "GV-1 Enterprise Agent Control Plane（レジストリ／ライフサイクル）",
    "summary": "社内の全エージェントを登録・所有者明示・審査・版管理・廃止まで一元統制する制御プレーン。",
    "applies_when": [
      "multi_department",
      "enterprise_scale",
      "audit_required",
      "prod_deployment"
    ],
    "not_applies_when": [
      "poc_phase",
      "single_team"
    ],
    "decision_keys": [
      "TO-8"
    ],
    "value_drivers": [
      "audit_compliance",
      "automation"
    ],
    "kpis": [
      "登録エージェント数",
      "未登録エージェント検知数",
      "ライフサイクルイベント追跡率"
    ],
    "prerequisites": [
      "ID-7"
    ],
    "related": [
      "GV-2",
      "GV-8",
      "OB-2"
    ],
    "maturity_stage": "foundation",
    "mvp": "エージェントレジストリ＋基本ライフサイクル管理（登録・停止・削除）",
    "cost_orientation": "M"
  },
  {
    "id": "GV-2",
    "plane": "governance",
    "title": "GV-2 Agent Catalog & Marketplace（社内カタログ）",
    "summary": "審査済みエージェント/スキル/ツールを社内アプリストアとして提供し、発見・申請・利用・複製を一元化するパターン。",
    "applies_when": [
      "multi_department",
      "enterprise_scale",
      "prod_deployment"
    ],
    "not_applies_when": [
      "single_team",
      "poc_phase",
      "poc_phase"
    ],
    "decision_keys": [
      "TO-8"
    ],
    "value_drivers": [
      "employee_efficiency",
      "automation"
    ],
    "kpis": [
      "カタログ掲載エージェント数",
      "再利用率",
      "デプロイリードタイム"
    ],
    "prerequisites": [
      "GV-1"
    ],
    "related": [],
    "maturity_stage": "execution",
    "mvp": "社内カタログUIに承認済みエージェント一覧を掲載",
    "cost_orientation": "S"
  },
  {
    "id": "GV-3",
    "plane": "governance",
    "title": "GV-3 Department Agent Factory（役割テンプレート工場）",
    "summary": "部門・役割ごとの標準テンプレート（ポリシー＋コネクタ＋評価パック付き）からエージェントを安全に量産するパターン。",
    "applies_when": [
      "multi_department",
      "enterprise_scale",
      "frequent_perm_chg"
    ],
    "not_applies_when": [
      "single_team",
      "poc_phase"
    ],
    "decision_keys": [
      "TO-8"
    ],
    "value_drivers": [
      "automation",
      "employee_efficiency"
    ],
    "kpis": [
      "部門エージェント作成リードタイム",
      "テンプレート利用率"
    ],
    "prerequisites": [
      "GV-1",
      "GV-2",
      "ID-4",
      "GV-4"
    ],
    "related": [],
    "maturity_stage": "execution",
    "mvp": "テンプレートライブラリ＋1部門でパイロット",
    "cost_orientation": "S"
  },
  {
    "id": "GV-4",
    "plane": "governance",
    "title": "GV-4 Industry Policy Pack（業界ポリシーパック）",
    "summary": "業界特有の規制・慣習・監査要件を再利用可能なポリシーパックとして定義し、policy-as-code・評価・データ分類・承認ルールへ展開するパターン。",
    "applies_when": [
      "regulated_industry",
      "multi_department",
      "enterprise_scale",
      "audit_required"
    ],
    "not_applies_when": [
      "single_team",
      "public_data_only"
    ],
    "decision_keys": [
      "DC-6"
    ],
    "value_drivers": [
      "audit_compliance"
    ],
    "kpis": [
      "規制準拠率",
      "ポリシー適用カバレッジ"
    ],
    "prerequisites": [
      "ID-6",
      "ID-7"
    ],
    "related": [],
    "maturity_stage": "foundation",
    "mvp": "自社の主要規制（1〜2本）に対応するポリシーパックを策定",
    "cost_orientation": "M"
  },
  {
    "id": "GV-5",
    "plane": "governance",
    "title": "GV-5 Central Model Gateway（モデル・ベンダー統制）",
    "summary": "全LLM呼び出しを単一GW経由にし、ベンダー承認・データ所在地・PII・コスト・監査を集中制御するパターン。",
    "applies_when": [
      "enterprise_scale",
      "confidential_data",
      "external_llm_api",
      "cost_mgmt_needed"
    ],
    "not_applies_when": [
      "poc_phase",
      "single_team"
    ],
    "decision_keys": [
      "TO-10",
      "DC-8"
    ],
    "value_drivers": [
      "audit_compliance",
      "automation"
    ],
    "kpis": [
      "モデル利用の可視化率",
      "非承認モデル利用件数",
      "レイテンシP95"
    ],
    "prerequisites": [
      "GV-1"
    ],
    "related": [],
    "maturity_stage": "foundation",
    "mvp": "単一ゲートウェイで全LLM呼び出しを中継しログ記録",
    "cost_orientation": "M"
  },
  {
    "id": "GV-6",
    "plane": "governance",
    "title": "GV-6 Version Registry（モデル/プロンプト/ツール/ポリシー/索引の版管理）",
    "summary": "モデル・プロンプト・ツール・ポリシー・RAG索引・スキーマをバージョン管理し、変更をPR・eval・カナリア・ロールバックの対象にするパターン。",
    "applies_when": [
      "continuous_updates",
      "prod_deployment",
      "audit_required",
      "multi_agent"
    ],
    "not_applies_when": [
      "poc_phase",
      "single_team"
    ],
    "decision_keys": [
      "DC-9"
    ],
    "value_drivers": [
      "audit_compliance",
      "automation"
    ],
    "kpis": [
      "バージョン追跡率",
      "ロールバック所要時間"
    ],
    "prerequisites": [
      "OB-1"
    ],
    "related": [],
    "maturity_stage": "execution",
    "mvp": "モデル・プロンプト・ポリシーの版をGitOpsで管理",
    "cost_orientation": "S"
  },
  {
    "id": "GV-7",
    "plane": "governance",
    "title": "GV-7 Evaluation & Governance Pipeline（評価CI/CD）",
    "summary": "品質・安全性・業務適合性を継続評価としてCIと本番の双方で測定し続けるエージェント評価パイプラインのパターン。",
    "applies_when": [
      "prod_deployment",
      "continuous_updates",
      "regulated_industry"
    ],
    "not_applies_when": [
      "poc_phase",
      "single_team"
    ],
    "decision_keys": [
      "DC-9",
      "DC-6"
    ],
    "value_drivers": [
      "decision_quality",
      "audit_compliance"
    ],
    "kpis": [
      "評価パイプライン実行頻度",
      "品質閾値違反率",
      "改善サイクルタイム"
    ],
    "prerequisites": [
      "OB-1"
    ],
    "related": [],
    "maturity_stage": "execution",
    "mvp": "主要エージェント1〜2体に自動評価パイプラインを設定",
    "cost_orientation": "M"
  },
  {
    "id": "GV-8",
    "plane": "governance",
    "title": "GV-8 Cost Quota & Chargeback（コスト配賦）",
    "summary": "トークン・ツール・実行コストをテナント/部門/プロジェクト/ユーザー単位で計測し、予算・上限・按分・ROIダッシュボードで可視化するパターン。",
    "applies_when": [
      "enterprise_scale",
      "cost_mgmt_needed",
      "multi_agent"
    ],
    "not_applies_when": [
      "poc_phase",
      "single_team"
    ],
    "decision_keys": [
      "DC-2"
    ],
    "value_drivers": [
      "executive_decision",
      "automation"
    ],
    "kpis": [
      "部門別AIコスト可視化率",
      "予算超過アラート件数",
      "コスト配賦精度"
    ],
    "prerequisites": [
      "GV-1",
      "GV-5"
    ],
    "related": [],
    "maturity_stage": "execution",
    "mvp": "部門タグ付きコスト計測＋月次レポート",
    "cost_orientation": "S"
  },
  {
    "id": "GV-9",
    "plane": "governance",
    "title": "GV-9 Incident Response & Kill Switch（事故対応・停止）",
    "summary": "誤送信・漏洩・暴走に備えた検知・粒度別停止・調査・復旧の仕組み。",
    "applies_when": [
      "prod_deployment",
      "enterprise_scale"
    ],
    "not_applies_when": [],
    "decision_keys": [
      "DC-1",
      "DC-9"
    ],
    "value_drivers": [
      "audit_compliance"
    ],
    "kpis": [
      "キルスイッチ発動までの平均時間",
      "インシデント復旧時間"
    ],
    "prerequisites": [
      "OB-1",
      "OB-2",
      "GV-1",
      "GV-5"
    ],
    "related": [],
    "maturity_stage": "foundation",
    "mvp": "全エージェントに即時停止APIを実装し、Slackからワンクリック停止",
    "cost_orientation": "S"
  },
  {
    "id": "GV-10",
    "plane": "governance",
    "title": "GV-10 Three-Layer Value Measurement（採用定着×生産性×経営KPI）",